Claro Wellbeing,https://www.crunchbase.com/organization/claro-money,5251000,USD,5251000,Private,Seed,11-50,"E-Learning, Financial Services, FinTech, Social Impact","London, England, United Kingdom","Claro Wellbeing is a employee benefits provider offering digital financial coaching, education and tools to teams.",,,"Alex Ford, Rob Brockington",https://clarowellbeing.com,For Profit,hello@claro.team,https://www.linkedin.com/company/claro-money,"Claro Wellbeing is a digital financial coach that helps and guides people to make smarter financial decisions everyday. Its packages are created and delivered by its in-house expert financial coaches, who have assisted hundreds of people in determining where they are on their financial journey and taking actionable steps to move forward. The company is providing financial wellness to employees through one-on-one coaching, interactive company webinars, and easily accessible educational resources. Claro Wellbeing mission is to provide employees with personalized financial advice to help them feel more confident and supported in their roles, increase engagement and performance, and improve workplace benefits to help retain employees and attract top talent.",$500M to $1B,2019-08-15,day,1000,USD,1000,"Education, Financial Services, Other, Software",Active,2020-05-31,,,,,
Deplike,https://www.crunchbase.com/organization/deplike,10000000,TRY,734074,Private,Seed,11-50,"Digital Entertainment, Education, Information Technology, iOS, Mobile, Music, Software","London, England, United Kingdom",Deplike is a music app that delivers a solution to handling real-time audio signal processing.,,,"Murat Sezgi, Ufuk Polat",http://deplike.com,For Profit,hello@deplike.com,https://www.linkedin.com/company/deplike/,"Deplike enables musicians to utilise their mobile devices to make music anywhere, at any time, by replacing bulky equipment. Their mobile app transforms any Android or iOS device into a guitar amp kit and effects processor for electric, acoustic, or bass guitars.",Less than $1M,2019-01-01,year,10000000,TRY,734074,"Education, Information Technology, Media and Entertainment, Mobile, Music and Audio, Platforms, Software",Active,2022-01-27,,,,,
Breathe Battery Technologies,https://www.crunchbase.com/organization/breathe-battery-technologies,1500000,GBP,1994954,Private,Seed,1-10,"Automotive, Battery, Energy Storage, Software","London, England, United Kingdom",Breathe Battery Technologies is a developer of electric vehicle battery charging control software for automotive manufacturers.,,,"Ian Campbell, Yan Zhao",https://www.breathe.technology,For Profit,,https://www.linkedin.com/company/breathe-battery-technologies,"Breathe Battery Technologies is a developer of electric vehicle battery charging control software for automotive manufacturers. The software improves battery capacity by 5% and allows for twice more uses in the battery’s lifetime, without requiring any costly or time consuming hardware changes.",,2019-01-01,year,1500000,GBP,1994954,"Energy, Software, Transportation",Active,2021-12-02,,,,,
Rocky,https://www.crunchbase.com/organization/rocky-robots-inc,776410,USD,776410,Private,Pre-Seed,1-10,"E-Learning, Personal Development, Personalization, Training","Preston, Lancashire, United Kingdom","Rocky is a personalized self-improvement app that uses interactive, intelligent, and guided journaling.",,,Harry Novic,https://www.rocky.ai,For Profit,hello@rocky.ai,https://www.linkedin.com/company/rocky-robots,"Rocky provides affordable coaching to young leaders through daily guided-coaching conversations, sharpening their soft skills.  In 2020 Rocky.ai was selected as TC Topic in the category Education / Social Impact for Techcrunch Disrupt San Francisco 2020. Start your personal growth journey and download Rocky.ai at your Google and Apple app stores.  Contact us if you are a coach or self-improvement book author and are looking for a partnership.",Less than $1M,2019-01-16,day,300000,GBP,406409,"Commerce and Shopping, Education, Software",Active,2022-02-08,,,,,
Nomod,https://www.crunchbase.com/organization/nomod,3400000,USD,3400000,Private,Seed,1-10,"Finance, Financial Services, FinTech, Payments","London, England, United Kingdom",Nomod creates a financial operating system for forward-thinking companies in emerging countries.,,,Omar Kassim,https://nomod.com/,For Profit,,https://www.linkedin.com/company/nomod/,Nomod creates a financial operating system for forward-thinking companies in emerging countries. Founded in 2019 and is based in London.,,2019-01-01,year,3400000,USD,3400000,"Financial Services, Payments",Active,2021-11-15,,,,,
Flown,https://www.crunchbase.com/organization/flown,3700000,GBP,4840156,Private,Seed,1-10,Software,"London, England, United Kingdom",Flown offers ideal mental and physical spaces for individuals and teams to think and work more creatively and productively.,,,Alicia Navarro,https://flown.com/,For Profit,hello@flown.com,https://www.linkedin.com/company/flown,Flown is a “deep work-as-a-service” that offers ideal mental and physical spaces for individuals and teams to think and work more creatively and productively.,,2019-01-01,year,2500000,GBP,3250472,Software,Active,2022-04-12,,,,,
Genei,https://www.crunchbase.com/organization/genei-1608,125000,USD,125000,Private,Pre-Seed,1-10,"Artificial Intelligence, Computer, Software","London, England, United Kingdom","Genie is an AI-powered platform for information extraction, note-taking, and research.",,,"Adrien Wald, Billy B. Richards, Jack Bowen",https://www.genei.io,For Profit,support@genei.io,https://www.linkedin.com/company/genei,"Genie is an AI-powered research platform that summarises background reading and produces blogs, articles, and reports automatically.",,2019-01-01,year,125000,USD,125000,"Artificial Intelligence, Consumer Electronics, Data and Analytics, Hardware, Science and Engineering, Software",Active,2021-09-17,,,,,
Neucruit,https://www.crunchbase.com/organization/neucruit,2429958,USD,2429958,Private,Seed,11-50,"Biotechnology, Clinical Trials, Health Care, Lifestyle","London, England, United Kingdom","Neucruit is transforming the efficiency, transparency and diversity of clinical trials",,,Livia Ng,https://www.neucruit.com,For Profit,hello@neucruit.com,https://www.linkedin.com/company/neucruit,"Neucruit is an intelligent software for clinical trial recruitment that helps sponsors and healthcare professionals reach thousands of potential participants in one click. Our technology aggregates real-time data from the over 25 million health-related conversations initiated online everyday to facilitate planning and recruitment in clinical trials. We support biopharmaceutical companies, site teams and investigators enhance site selection, optimise recruitment materials and reach groups that cannot be easily accessed through traditional methods. #Innovation #DataToInformIntuition For information on clinical trial planning, outreach and recruitment, email research@neucruit.com",,2019-01-01,year,1000000,USD,1000000,"Biotechnology, Community and Lifestyle, Health Care, Science and Engineering",Active,2022-02-21,,,,,
The Joy Club,https://www.crunchbase.com/organization/the-joy-club,1467689,USD,1467689,Private,Pre-Seed,11-50,"Events, Online Portals, Retirement","London, England, United Kingdom",The Joy Club is an online community that brings people together over shared interests and provides inspiration for a joyful retirement.,,,,https://thejoyclub.com/,For Profit,hello@thejoyclub.com,https://www.linkedin.com/company/the-joy-club/,"The Joy Club is an online community where members can learn from the experts, keep their minds and bodies active and connect with people who share their interests.",,2019-11-22,day,25000,EUR,24596,"Community and Lifestyle, Events, Internet Services, Media and Entertainment, Other",Active,2022-09-22,,,,,
SympliFi,https://www.crunchbase.com/organization/symplifi,120000,USD,120000,Private,Pre-Seed,1-10,"Financial Services, FinTech","London, England, United Kingdom",SympliFi is transforming the way credit works in emerging markets to fuel economic growth.,,,"Gregoire Lecomte, Maurice Iwunze",https://www.symplifi.co/about-us,For Profit,founders@symplifi.co,https://www.linkedin.com/company/symplifi,FinTech,,2019-01-01,year,120000,USD,120000,Financial Services,Active,2021-01-25,,,,,
Drag,https://www.crunchbase.com/organization/drag,488141,USD,488141,Private,Seed,11-50,"Email, Productivity Tools, SaaS, Software, Task Management","London, England, United Kingdom","The Everything Inbox for teams. One single place to support customers, manage tasks and close deals, from the place teams love - Email.",,,"Eduarda Bardavid, Nick Timms",http://www.dragapp.com/,For Profit,access@dragapp.com,https://www.linkedin.com/company/dragapp,"Transform your Gmail into organized Task Lists. Transform your Gmail into organized Task Lists. Drag’s free Task List app turns your inbox into a manageable workspace (just like Trello, but for Gmail).  Drag ‘n drop your emails between lists/stages and customize them. It makes the hours spent in your inbox a whole lot easier and more organized.  We use a layout called ‘Kanban’ right inside Gmail. You’ll know it from tools such as Trello or Pipedrive. Kanban is a way of managing tasks in a lean way and allows you to visually map your workflow. ☆☆☆ Featured in Chrome store (Twice), Product Hunt (Top 5), Hacker News, Mashable, Lifehacker, Reddit  ☆☆☆ ★ Turn Gmail into a Kanban board Drag transforms your inbox into a Kanban board with one single click.  ★ Drag ‘n Drop emails Manage all of your tasks from one easy-to-use Drag‘n‘Drop workspace.  ★ Customize your Task Lists Organize emails into simple lists. Edit column names and add as many columns as you want.  ★ Add inbox tasks Manage emails and add custom Tasks to your Kanban boards.  ★ Drag Pro If you want to supercharge managing your Tasks, Drag Pro is your answer. Here’s what you can do with Pro:   ➤  Share Task Lists. Customize and share Task Lists with your team.   ➤  Add notes and checklists. Add notes and checklists to each of your emails and Tasks.   ➤  Add due dates to emails. Apply due dates to your emails and tasks and visualize them in your boards. Learn more about Drag Pro at www.dragapp.com/pricing ★Interested in what we have planned?★ Suggest and vote for new features here: https://trello.com/b/41FGtlod/drag-public-roadmap Here’s what some of our users have said:  “I was chomping at the bit for this!!!! Now I have it, I’m in love with it. I am in project management, so on top of managing myself I have to manage a lot of others. While I have to-do systems such as Trello and Asana, most of those to-dos are spurred from emails (or an email that has a lot of information)."" ""I’ve tried setting up folders and didn’t work. It made it so hard until now. Drag, simply put, is awesome. I can now run my inbox like I do my tasks inside Trello.” “We’ve previously used tools such as Wunderlist, Asana, Evernote, Todoist, Any.do, Trello and Sortd however they’re all focused on managing Tasks inside a tool. I need to manage my tasks inside my email. Booooom, then Drag came a long. Honestly, it’s the most productive Chrome extension I’ve used in years. Thanks Drag, I’m an official Dragster now!” “Email is the perennial problem for me, because I want to use it as a todo list, but I also want a zero inbox. I’m a huge fan of Trello, it is the most productive workspace I have today.  So when I saw Drag, the light went on and I am now unable to live without it.” “We’ve tried them all from Trello, Asana, Evernote through to Sortd and others. Drag complements my use of Trello perfectly. I don’t want all Tasks inside Trello so to run my Gmail separately works amazingly well.” How does Drag compare to other tools?  If you’re considering what Task Management or Project Management tools you should be using in your spare time and improve what you’re doing, there’s a lot of options.  From regular old spreadsheets to manage Tasks to specific Kanban boards of software, sales and marketing. There are dozens of solutions (we love Trello) and Drag works perfectly with them. Don’t replace your main tools, instead use Drag to apply the same principles of being efficient with tasks, inside your inbox.  www.dragapp.com ",,2019-01-02,day,2000000,BRL,368141,"Information Technology, Internet Services, Messaging and Telecommunications, Software",Active,2021-02-01,,,,,
Unlock,https://www.crunchbase.com/organization/unlock-73d9,2162496,USD,2162496,Private,Seed,11-50,"Social Network, Software, Video Conferencing","London, England, United Kingdom",Anti-boring activities for remote teams,,,Maria Wlosinska,https://www.joinunlock.com/,For Profit,,https://www.linkedin.com/company/joinunlock/,Unlock is a video-based platform packed with unique experiences your team will love.,,2019-01-01,year,1730000,EUR,2006725,"Hardware, Information Technology, Internet Services, Messaging and Telecommunications, Software",Active,2021-11-01,,,,,
CAPSLOCK,https://www.crunchbase.com/organization/capslock-c60b,1011000,GBP,1364907,Private,Pre-Seed,11-50,"Cloud Security, Continuing Education, Cyber Security, EdTech, Education, Higher Education, Information Technology, Network Security, Training, Vocational Education","Manchester, Manchester, United Kingdom",CAPSLOCK re-skill adults into cyber security professionals at no up-front costs. Voted as UK's most innovative cyber security start-up 2021.,,,"Dr. Andrea Cullen, Jonathan Slater, Lorna Armitage",https://capslock.ac,For Profit,hello@capslock.ac,https://www.linkedin.com/company/capslockuk,"Voted as the UK's most innovative cyber security start-up by TechUK & DCMS, CAPSLOCK re-skill adults into cyber security professionals at no up-front costs. Their 4-month intensive online bootcamp costs £0 until a learner lands a job paying over £27k.  In March 2021, CAPSLOCK launched their pilot cohorts using income share agreements, re-skilling 86 adults who didn’t pay any up-front costs. Professional dancers, chefs, military veterans, accountants, and other career-changers enrolled and have since started lucrative cyber security careers. Dyson, the BBC, ITV, BAE, HSBC, Boohoo, and PwC have all hired CAPSLOCK graduates in aid of tackling the cyber security skills shortage. As part of their Income Share Agreement, those graduates will repay a percentage of their monthly income back to CAPSLOCK over a set period of time, but only once they have landed a high-paying role.",,2019-09-11,day,484000,GBP,649145,"Education, Information Technology, Privacy and Security, Software",Active,2021-11-10,,,,,
NOQ,https://www.crunchbase.com/organization/noq-group,768010,GBP,984016,Private,Seed,1-10,"Event Management, Financial Services, FinTech, Food and Beverage, Software","London, England, United Kingdom",Providing real-time visibility and instant revenue splits,,,"Andrea Diaferio, Param Kanabar",https://www.noqgroup.com/,For Profit,contact@noqgroup.com,https://www.linkedin.com/company/noqgroup/,"The only platform of its kind, connecting multiple accounts for sales transparency, automated payment distribution and seamless operational execution.",,2019-02-04,day,427000,GBP,511031,"Events, Financial Services, Food and Beverage, Media and Entertainment, Software",Active,2022-07-20,,,,,
SPOKE,https://www.crunchbase.com/organization/spoke-6c42,1100000,GBP,1493997,Private,Seed,1-10,,"London, England, United Kingdom",SPOKE is a sleep music app.,,,"Ariana Alexander-Sefre, Michael Maher",http://spoke.world,For Profit,hello@spoke.world,https://www.linkedin.com/company/spokeworld/,"SPOKE is an app that provides an audio experience for well-being. It uses a unique blend of lo-fi music, hip hop, and mindfulness to help users re-tune their minds, sleep better, and strengthen their mindset. Each soothing episode includes music and spoken word by some of the UK's best producers and emerging artists, all of whom have been trained by neuroscientists, psychologists, and therapists.",,2019-01-01,year,1100000,GBP,1493996,,Active,2022-02-16,,,,,
BlueSkeye AI,https://www.crunchbase.com/organization/blueskeye-ai,3800000,EUR,3747028,Private,Seed,1-10,"Artificial Intelligence, Health Care, Health Diagnostics","Nottingham, Nottingham, United Kingdom",BlueSkeye AI is using technology that can comprehend mood and mental wellbeing to approach healthcare from an AI perspective.,,,,https://www.blueskeye.com/,For Profit,,https://www.linkedin.com/company/blueskeye-ai/,BlueSkeye AI is using technology that can comprehend mood and mental wellbeing to approach healthcare from an AI perspective.,,2019-01-01,year,3800000,EUR,3747028,"Artificial Intelligence, Data and Analytics, Health Care, Science and Engineering, Software",Active,2022-10-21,,,,,
CattleEye,https://www.crunchbase.com/organization/cattle-eye,4985426,USD,4985426,Private,Seed,11-50,,"Belfast, Belfast, United Kingdom","CattleEye provides a complete solution to livestock farmers, allowing them to monitor the performance and welfare of their cows.",,,"Adam Askew, Terry Canning",http://www.cattleeye.com/,For Profit,,https://www.linkedin.com/company/cattleeye,"CattleEye provides a complete solution to livestock farmers, allowing them to monitor the performance and welfare of their cows.",,2019-01-01,year,2500000,USD,2500000,,Active,2021-09-29,,,,,
Pentire Drinks,https://www.crunchbase.com/organization/pentire-drinks,3000000,GBP,3679916,Private,Seed,1-10,,"Wadebridge, Cornwall, United Kingdom","Pentire Drinks is a beverage company that offers botanical, non-alcoholic spirits.",,,Alistair Frost,https://pentiredrinks.com,For Profit,hello@pentiredrinks.com,https://www.linkedin.com/company/pentire-drinks,"Pentire Drinks is a beverage company that offers botanical, non-alcoholic spirits. The company was founded by Alistair Frost and is headquartered in Wadebridge, England.",,2019-01-01,year,3000000,GBP,3679915,,Active,2022-06-27,,,,,
Farmz2U,https://www.crunchbase.com/organization/farmz2u,355500,USD,355500,Private,Seed,1-10,Agriculture,"London, England, United Kingdom",Farmz2U is helping farmers farm better with tailored agricultural expertise using data and access to market.,,,"Aisha Raheem-Bolarinwa, Oluwatimilehin Akogun",https://www.farmz2u.com/,For Profit,aisha.raheem@farmz2u.co.uk,https://www.linkedin.com/company/farmz2u,Farmz2U is an infrastructure company that assists smallholder farmers in operating on a commercial scale. It supports smallholder farmers with 'access to information' and 'access to resources' to scale local farm production.,,2019-01-01,year,200000,USD,200000,Agriculture and Farming,Active,2023-01-10,,,,,
Slingshot Simulations,https://www.crunchbase.com/organization/slingshot-simulations,5250000,GBP,6660134,Private,Series A,11-50,"Geospatial, Internet of Things, Mapping Services, Simulation, Software","Leeds, Leeds, United Kingdom",Slingshot Simulations a provider of cutting-edge technologies and services.,,,David McKee,https://www.slingshotsimulations.co.uk/,For Profit,,https://www.linkedin.com/company/slingshotsimulations/,"Slingshot Simulations a provider of cutting-edge technologies and services, offering scalable simulation and Digital Twin solutions for businesses of all sizes.",,2019-05-01,month,3000000,GBP,3699469,"Data and Analytics, Internet Services, Navigation and Mapping, Software",Active,2023-01-24,,,,,
Travel Ledger,https://www.crunchbase.com/organization/travel-ledger,2750000,GBP,3378308,Private,Seed,11-50,"FinTech, Travel","London, England, United Kingdom",Travel Ledger is a travel settlement platform built for the global travel industry,,,"Chuck Richardson, Justin Morshead, Roberto Da Re",http://travelledger.org/#,For Profit,hello@travelledger.org,https://www.linkedin.com/company/travel-ledger/,Travel Ledger is a travel settlement platform built for the global travel industry and launched in the UK in 2021. It is combination of Fintech and Traveltech. As at 2022 Travel Ledger currently has 1800 retailers and suppliers across 400 brands on its network settling in excess of £60m per month. It plans to open its services in the EU in late 2022 and in North America in 2023.,$1M to $10M,2019-07-01,month,1400000,GBP,1636485,"Financial Services, Travel and Tourism",Active,2022-09-12,,,,,
Idenfo,https://www.crunchbase.com/organization/idenfo,1281756,GBP,1730865,Private,Pre-Seed,51-100,"Cloud Computing, Information Technology, SaaS, Software","London, England, United Kingdom","Idenfo Direct provides subscription-based, cloud-native e2e digital onboarding and AML solution.",,,"Antony Bellingall, Naseer Hasan, Raza Abidi",https://idenfodirect.com,For Profit,info@idenfo.com,https://www.linkedin.com/company/idenfo,"Idenfo Direct provides subscription-based, cloud-native e2e digital onboarding and AML solution. Idenfo Direct is the solution for businesses to know and verify their customers, buyers, tenants, employees, and business partners. At every stage, Idenfo Direct's technology improves customer onboarding and verification.",,2019-05-17,day,833756,GBP,1128197,"Information Technology, Internet Services, Software",Active,2022-01-01,,,,,
Sook,https://www.crunchbase.com/organization/sook,1347000,GBP,1782052,Private,Pre-Seed,11-50,Retail Technology,"London, England, United Kingdom",Sook is a retail asset management solution that transforms vacant retail units into customizable digital spaces that are rented by the hour,,,"Daniel Burnham, John Hoyle",https://www.sook.space/,For Profit,enquiries@sook.space,https://www.linkedin.com/company/sook/,"Sook is a new high street destination that offers flexible, sustainable, and digitally connected pop-up space by the hour. It aims to revolutionize the high street by providing flexible, sustainable, digitally-enabled 'pop-up' space to any brand, business, or community that needs it - when they need it - in prime retail locations, bookable by the hour. The company was founded in 2019 and is based in London, England.",,2019-03-01,day,847000,GBP,1134970,"Commerce and Shopping, Hardware, Software",Active,2020-09-01,,,,,
UMNAI,https://www.crunchbase.com/organization/umnai,3375000,EUR,3921629,Private,Seed,11-50,"Artificial Intelligence, Machine Learning","London, England, United Kingdom",UMNAI specializes in neuro-symbolic machine learning and artificial intelligence and have created Hybrid Intelligence products.,,,"Angelo Dalli, Ken Cassar, Olga Finkel, Olga Finkel",http://umnai.com,For Profit,info@umnai.com,https://www.linkedin.com/company/umnai,"Deep, enabling Hybrid Intelligence technology that shifts the frontier on explainable AI and that will change the way we conceive, build and consume AI beyond the current limitations of opaque machine learning.",,2019-06-10,day,1400000,EUR,1623939,"Artificial Intelligence, Data and Analytics, Science and Engineering, Software",Active,2021-11-01,,,,,
Haystack,https://www.crunchbase.com/organization/wearehaystack,1965000,GBP,2594928,Private,Seed,11-50,"Database, Software","Newcastle Upon Tyne, Newcastle upon Tyne, United Kingdom",Where techies discover opportunities.,,,"Chris Bone, Mike Davies, Robert Simmons",https://www.haystackapp.io,For Profit,hello@haystackapp.io,https://www.linkedin.com/company/wearehaystack,"Haystack Built for techies who are fed up with the age-old recruitment approach, Haystack is a data insights and careers marketplace that uncovers opportunities based on your interests, values and tech stack.",,2019-08-12,day,500000,GBP,602288,"Data and Analytics, Software",Active,2022-08-17,,,,,
Inhabit,https://www.crunchbase.com/organization/inhabit-5276,1425000,GBP,1724057,Private,Seed,1-10,"Environmental Consulting, Renewable Energy, Sustainability","London, England, United Kingdom",Inhabit is a web platform helping businesses achieve net zero.,,,"Cameron Epstein, Holly Mckay, Sam McKay, Shoniwa Marovatsanga",https://www.inhabit.eco,For Profit,team@inhabit.eco,https://www.linkedin.com/company/inhabit-eco,Inhabit is a web platform enabling businesses to reduce their environmental impact.,,2019-01-01,year,1200000,GBP,1434144,"Energy, Professional Services, Sustainability",Active,2022-07-05,,,,,
TAUR,https://www.crunchbase.com/organization/taur,5200000,USD,5200000,Private,Seed,11-50,"Consumer Electronics, Electric Vehicle, Transportation","London, England, United Kingdom",The electric scooter built for life in the city. Available for pre-order now. Winner of 2021 GOOD DESIGN® Awards.,,,"Carson Brown, Richard Adey",https://www.taur.com/,For Profit,hello@taur.com,https://www.linkedin.com/company/taur-technologies/,"TAUR Technologies was founded in 2019 by Richard Adey and Carson Brown. The brand is on a mission to make e-scooters a truly viable form of urban transport, combining stylish, world-class products with great user experience. From their London base, they’ve gathered a team from companies such as Tesla, McLaren and Uniwheel. In January 2022, TAUR won a GOOD DESIGN® Award.",,2019-01-01,year,3300000,USD,3300000,"Consumer Electronics, Hardware, Transportation",Active,2022-02-25,,,,,
IONATE,https://www.crunchbase.com/organization/ionate-ltd,3300000,GBP,3991350,Private,Seed,1-10,Power Grid,"London, England, United Kingdom",IONATE is a technology company developing next-generation Hybrid Intelligent Transformers.,,,,https://www.ionate.energy/,For Profit,,https://uk.linkedin.com/company/ionate-energy,IONATE Ltd. is a technology company developing next-generation Hybrid Intelligent Transformers.,,2019-01-01,year,3300000,GBP,3991349,Energy,Active,2022-08-16,,,,,
