Organization Name,Organization Name URL,Total Funding Amount,Total Funding Amount Currency,Total Funding Amount Currency (in USD),IPO Status,Last Funding Type,Number of Employees,Industries,Headquarters Location,Description,Transaction Name,Transaction Name URL,Founders,Website,Company Type,Contact Email,LinkedIn,Full Description,Estimated Revenue Range,Founded Date,Founded Date Precision,Last Funding Amount,Last Funding Amount Currency,Last Funding Amount Currency (in USD),Industry Groups,Operating Status,Last Funding Date,School Type,School Program,Number of Enrollments,School Method,Number of Founders (Alumni)
Stability AI,https://www.crunchbase.com/organization/stability-ai,89000000,GBP,98797885,Private,Seed,51-100,"Artificial Intelligence, Image Recognition, Information Technology, Software","London, England, United Kingdom",AI-driven visual art startup that designs and implements an open AI tools.,,,Emad Mostaque,https://stability.ai/,For Profit,info@stability.ai,https://www.linkedin.com/company/stability-ai,"Stability AI is an AI-driven visual art startup that designs and implements an open AI tool to create images based on text input given. This tool executes text commands into images and other forms of media using collective intelligence and augmented technology to help clients develop cutting-edge open AI models for image, language, audio, video, 3D, and biology. The company was founded in 2019 and is headquartered in London, England.",,2019-01-01,year,89000000,GBP,98797885,"Artificial Intelligence, Data and Analytics, Information Technology, Science and Engineering, Software",Active,2022-10-12,,,,,
Arloid Automation,https://www.crunchbase.com/organization/arloid-automation,14918000,USD,14918000,Private,Pre-Seed,51-100,"Artificial Intelligence, Energy Efficiency, Energy Management, Information Technology, Machine Learning, Smart Building, Software","London, England, United Kingdom",The ultimate AI solution for energy efficiency,,,"Max Zubov, Sergey Shalunov, Vladimir Pushmin",https://arloid.com,For Profit,info@arloid.com,https://www.linkedin.com/company/arloid,"We resolve energy inefficiency in real estate.  Arloid Automation is a global leader in AI-based solutions designed to simplify MEP (mechanical, electrical and plumbing engineering) systems management for a broad portfolio of real estate.  Our unique algorithm combines the power of Deep Reinforced Learning and Digital Twin technologies enabling real estate management companies to meet their financial and sustainability objectives.  Simple to deploy and intuitive to manage, arloid.ai solution, in real-time, intelligently and precisely adjusts HVAC systems settings resulting in up to 40% reduction in utility consumption bills and carbon footprint. With zero CAPEX and no additional hardware installation, our risk-free and proven technology delivers measurable results in under 60 days.  Headquartered in London, UK, Arloid Automation has representative offices in Dubai and Singapore as well as a developed international partner network.",,2019-11-04,day,8018000,USD,8018000,"Artificial Intelligence, Data and Analytics, Energy, Information Technology, Real Estate, Science and Engineering, Software, Sustainability",Active,2022-01-01,,,,,
Emperia,https://www.crunchbase.com/organization/emperia,10703105,USD,10703105,Private,Series A,11-50,"E-Commerce, Marketing, Retail, Software, Virtual Reality, Web Design","London, England, United Kingdom",Powering the creation and management of immersive virtual experiences for retailers,,,"Olga Dogadkina, Simonas Holcmann",https://emperiavr.com,For Profit,contact@emperiavr.com,https://www.linkedin.com/company/emperialondon,"The Emperia platform powers the creation and management of immersive virtual experiences for brands across multiple retail sectors. The platform marries the reach and accessibility of e-commerce with the impact of physical customer service shopping experience, while leveraging the unique traits of the virtual space; adding a layer of customer engagement, personalization, data monitoring and omnichannel cohesion. London and New York-based, the Emperia team consists of  3D environment engineers and technical artists joined by  fashion and art industry veterans and branding experts. Hailed a virtual reality pioneer by Forbes Magazine, Emperia is working with some of the world’s leading names in art, fashion and retail including Dior, Burberry, Bloomingdale's, Tommy Hilfiger,  Harrods, Giorgio Armani, Lacoste, Dom Pérignon, Christie’s, Getty Images and more. Emperia has been named one of the most promising advertising and marketing tech startups of 2022 by BusinessInsider, is a proud British Fashion Council Patron and the winner of the Plug & Play Brand & Retail Europe Start-Up Award.",,2019-05-20,day,10000000,USD,10000000,"Commerce and Shopping, Design, Hardware, Sales and Marketing, Software",Active,2023-01-25,,,,,
Attio,https://www.crunchbase.com/organization/attio,31200000,USD,31200000,Private,Series A,11-50,"CRM, Information Technology, Software","London, England, United Kingdom","Attio is the CRM of the future: data-driven, completely customizable and intuitively collaborative.",,,"Alexander Christie, Nicolas Sharp",https://attio.com,For Profit,support@attio.com,https://www.linkedin.com/company/attio,"Business software is changing fast. Notion is changing how we organize, Slack is replacing internal email, and Miro is transforming how we whiteboard. But one thing hasn't changed: relationships. Relationships are the most important part of business but somehow our tools have been left in the past. It's time for an upgrade.",,2019-01-01,year,23500000,USD,23500000,"Information Technology, Sales and Marketing, Software",Active,2023-03-01,,,,,
Valve,https://www.crunchbase.com/organization/valve,4500000,USD,4500000,Private,Seed,1-10,Software,"London, England, United Kingdom",Valve is the global industry system for flexible workspaces.,,,,https://www.valvespace.com/,For Profit,,,"Valve provides industry-leading sales, marketing, and distribution solutions for landlords, operators, and brokerages transacting in the flexible workspace market.",$1M to $10M,2019-01-01,year,4500000,USD,4500000,Software,Active,2022-09-15,,,,,
Unitary,https://www.crunchbase.com/organization/unitary,8000000,GBP,9598662,Private,Seed,11-50,"Artificial Intelligence, Content, Software","Cambridge, Cambridgeshire, United Kingdom",Unitary builds context-aware AI and multimodal machine learning approaches to analyze content in context.,,,"James Thewlis, Sasha Haco",https://unitary.ai,For Profit,,https://www.linkedin.com/company/unitaryai/,"Unitary creates context-aware AI and multimodal machine learning approaches to analyze content in context. It allows users to detect inappropriate content and take action to protect their community. Their goal is to keep the internet safer by accurately, quickly, and efficiently interpreting material.",Less than $1M,2019-06-01,month,6700000,GBP,7924127,"Artificial Intelligence, Data and Analytics, Media and Entertainment, Science and Engineering, Software",Active,2023-03-07,,,,,
Connectd,https://www.crunchbase.com/organization/linkexec,5590212,USD,5590212,Private,Seed,11-50,"Angel Investment, Financial Services, Funding Platform, Information Services, Software, Venture Capital","London, England, United Kingdom","Connectd is a product ecosystem that empowers founders, investors and advisors to manage connections.",,,"Roei Samuel, Sam Luckett",https://www.connectd.co/,For Profit,info@connectd.co,https://www.linkedin.com/company/18103326/,"Connectd is a product ecosystem that empowers founders, investors, and advisors to make and manage connections. Connectd is developing solutions that create connections in order to help startups grow and people flourish.",,2019-10-01,month,2600000,USD,2600000,"Financial Services, Information Technology, Lending and Investments, Software",Active,2023-03-13,,,,,
Phlo,https://www.crunchbase.com/organization/phlo-7035,16655380,GBP,20851743,Private,Series A,11-50,"Health Care, Internet, Medical, Pharmaceutical","London, England, United Kingdom","Phlo is a digital pharmacy that provides secure, real-time, same-day prescription delivery.",,,Nadeem Sarwar,http://www.wearephlo.com,For Profit,hello@wearephlo.com,https://www.linkedin.com/company/wearephlo/,"Phlo is a digital pharmacy delivering NHS & Private prescriptions when and where you need them. Phlo works with both repeat and acute (one-off) prescriptions. Phlo uses technology and analytics to place patients at the heart of our business, providing patients with real-time, on-demand delivery of their acute and repeat prescriptions. Phlo was established in January, 2019 in London, England by Nadeem Sarwar.",,2019-01-01,month,10000000,GBP,12221144,"Health Care, Internet Services",Active,2023-02-02,,,,,
Snoop,https://www.crunchbase.com/organization/snoop-09b7,28200000,GBP,37702199,Private,Series A,11-50,"Financial Services, FinTech, Mobile Apps","Norwich, Norfolk, United Kingdom",Snoop is a smart money mobile app that helps consumers save money on bills and subscriptions.,,,"Cara Norton, David Dyer, Jayne-Anne Gadhia, Jem Walters, John Natalizia, Ken Donald, Paul Kerridge, Paul Lloyd, Ross Logan, Scott Mowbray",https://snoop.app/,For Profit,hello@snoop.app,https://www.linkedin.com/company/snoop/,"Snoop is a smart money mobile app that helps consumers save money on bills and subscriptions. Snoop combines a smart artificial intelligence platform with human intelligence which tracks finances and offers its users recommendations for cutting bills and subscription expenses.  The company was founded in 2019 by Jayne-Anne Gadhia and it is based in Norwich, Norfolk.",$1M to $10M,2019-01-01,year,15000000,GBP,20837674,"Apps, Financial Services, Mobile, Software",Active,2021-08-02,,,,,
Hidden Road,https://www.crunchbase.com/organization/hidden-road,50000000,USD,50000000,Private,Series A,,,"London, England, United Kingdom",Hidden Road is the global credit network for institutional investors and provides easy access to both traditional and digital markets.,,,,https://hiddenroad.com,For Profit,info@hiddenroad.com.,,Hidden Road is the global credit network for institutional investors and provides easy access to both traditional and digital markets.,$1M to $10M,2019-01-01,year,50000000,USD,50000000,,Active,2022-07-07,,,,,
Transak,https://www.crunchbase.com/organization/transak,2960000,USD,2960000,Private,Seed,51-100,"Apps, Cryptocurrency, Debit Cards, FinTech, Payments","London, England, United Kingdom",Transak provides onboarding infrastructure to make web3 applications accessible.,,,"Sami Start, Yeshu Agarwal",http://transak.com,For Profit,marketing@transak.com,https://www.linkedin.com/company/transak/,"Transak provides onboarding infrastructure to make web3 applications accessible. The company's Fiat On/Off-Ramp product powers over 120 apps, including - Wallets such as Metamask and Trust Wallet - DeFi and CeFi such as CakeDeFi and Quickswap - Games such as Splinterlands, and Decentraland. It also provides a suite of other onboarding solutions like Direct-to-protocol and NFT checkout, where users can onboard to a protocol or buy an NFT with fiat in a single click, making web3 apps more accessible for mainstream users.",,2019-01-01,day,2400000,USD,2400000,"Apps, Financial Services, Payments, Software",Active,2021-07-01,,,,,
Ben,https://www.crunchbase.com/organization/ben-9844,18500000,USD,18500000,Private,Series A,11-50,"Debit Cards, Employee Benefits, FinTech, Health Insurance, Human Resources, Insurance, Life Insurance, Payments, SaaS, Software","London, England, United Kingdom","Make benefits work for everyone, everywhere",,,"David Duckworth, Sebastian Fallert",https://www.thanksben.com/,For Profit,hello@thanksben.com,https://www.linkedin.com/company/thanksben,"Ben is the all-in-one employee benefits platform for any company to personalise benefits and reward. Our secret? Marrying a modern software (SaaS) platform with per-employee Mastercards and financial infrastructure. That’s how Ben instantly adds employee choice to your existing benefits, unlocks access to hundreds of additional options through Ben Card, all while saving you time and money.",$1M to $10M,2019-11-27,day,16000000,USD,16000000,"Administrative Services, Financial Services, Health Care, Payments, Software",Active,2022-08-03,,,,,
Zipzero,https://www.crunchbase.com/organization/zipzero-global-limited,1000000,GBP,1206219,Private,Seed,1-10,"Consumer Research, E-Commerce, Fast-Moving Consumer Goods, Lead Generation, Location Based Services, Market Research, Retail, Retail Technology, Shopping","London, England, United Kingdom","Zipzero users can earn cash rewards by sharing receipts from everyday purchases, which they can then use to pay household utility bills.",,,"Agnes Monod-Gayraud, Aymeric Monod-Gayraud, Marcin Walaszczyk, Mohsin Rashid",https://zipzero.com,For Profit,founders@zipzero.com,https://www.linkedin.com/company/zipzero/,"Zipzero users can earn cash rewards by sharing receipts from everyday purchases, which they can then use to pay household utility bills. Our path to scale is in partnership with leading utilities, who are encouraged to push ZIPZERO to their customers as we help them pay their bills.",,2019-01-01,year,1000000,GBP,1206218,"Commerce and Shopping, Consumer Goods, Data and Analytics, Design, Hardware, Internet Services, Navigation and Mapping, Real Estate, Sales and Marketing, Software",Active,2023-02-27,,,,,
Emitwise,https://www.crunchbase.com/organization/emitwise,16645316,USD,16645316,Private,Series A,11-50,"Artificial Intelligence, CleanTech, GreenTech, SaaS, Supply Chain Management","London, England, United Kingdom",Emitwise is an AI-powered carbon management platform that helps businesses in tracking and managing their carbon footprint.,,,"Benjamin Peddie, Eduardo Gómez, Mauro Cozzi",http://www.emitwise.com,For Profit,stephanie@emitwise.com,https://www.linkedin.com/company/emitwise,"Emitwise’s unique AI technology empowers companies to automatically measure, report, and reduce their carbon footprint across their operations and supply chain, future-proofing businesses for a zero-carbon world. The company is backed by top Silicon Valley investors and trusted by leading global businesses.   Emitwise's mission is to empower businesses to respond to the climate emergency, accelerating the transition to a net-zero carbon world by equipping them with all the tools they need to drive emissions cuts across their operations and supply chain.",,2019-01-01,year,9000000,EUR,10045315,"Artificial Intelligence, Data and Analytics, Science and Engineering, Software, Sustainability, Transportation",Active,2022-03-30,,,,,
Toqio,https://www.crunchbase.com/organization/toqio-fintech,28000000,EUR,29117047,Private,Series A,51-100,"Banking, Finance, Financial Services, FinTech","London, England, United Kingdom",Toqio enables organizations to develop their fintech solution as an app or on the web.,,,"Eduardo Martínez Garcia, Michael Galvin",https://toqio.co/,For Profit,support@toq.io,https://www.linkedin.com/company/toqiofintech/,"Toqio enables organizations to develop their fintech solution as an app or on the web. It is supported by a configuration and customization platform and a marketplace of partners. The company was founded in 2019 by Eduardo Martinez and Michael Galvin with offices in London, Madrid, and Nairobi,",,2019-01-01,month,18700000,EUR,18380835,"Financial Services, Lending and Investments",Active,2022-09-29,,,,,
Fasset,https://www.crunchbase.com/organization/fasset,26700000,USD,26700000,Private,Series A,11-50,"Asset Management, Blockchain, Cryptocurrency, Financial Services, FinTech","London, England, United Kingdom",Fasset is a global digital asset exchange that provides people in emerging markets with accessibility to the digital asset space.,,,"Daniel Ahmed, Mohammad Raafi Hossain, Mohammed Al Sharaf",http://www.fasset.io,For Profit,info@fasset.io,https://www.linkedin.com/company/fassethq,"Fasset is a global digital asset gateway that brings accessibility to the digital asset space. Through its digital assets, Fasset provides people in emerging markets the opportunity to build a better future. The company is pioneering web3 technologies and driving adoption of digital assets for the next billion.",,2019-05-01,month,22000000,USD,22000000,"Financial Services, Other, Payments, Software",Active,2022-04-15,,,,,
Teya,https://www.crunchbase.com/organization/saltpay,1090000000,USD,1090000000,Private,Series C,1001-5000,"Financial Services, FinTech, Information Technology","London, England, United Kingdom","Teya builds tools for SMBs to unlock hassle-free payments, better business management, new and returning customers, all on fair terms.",,,"Ali Mazanderani, Eduardo Pontes",https://www.teya.com,For Profit,help@teya.com,https://www.linkedin.com/company/teya-global/ ,"Born in 2019, Teya is a pan-European company with a global presence.  Teya build tools to unlock hassle-free payments, better business management, new and returning customers, all on fair terms. The all-in-one offering is designed to simplify the everyday and unlock growth potential, to free them from the stuff that takes the joy out of doing business.",$100M to $500M,2019-01-01,year,370000000,USD,370000000,"Financial Services, Information Technology",Active,2021-11-15,,,,,
Recycleye,https://www.crunchbase.com/organization/recycleye,25979388,USD,25979388,Private,Series A,11-50,"Analytics, Machine Learning, Waste Management","London, England, United Kingdom",Recycleye is a developer of digital tools designed to detect and provide analytics on waste management.,,,"Peter Hedley, Victor Dewulf",https://recycleye.com/,For Profit,hello@recycleye.com,https://www.linkedin.com/company/recycleye/,"Recycleye is a developer of digital tools designed to detect and provide analytics on waste management. The company's tools specialize in machine learning tools to enable smarter characterization, ubiquitous tracking, and automated sorting of waste, enabling users to accelerate the transition towards a circular economy. Recycleye was established on September 23, 2019 in London, England by Victor Dewulf.",,2019-09-23,day,17000000,USD,17000000,"Artificial Intelligence, Data and Analytics, Software, Sustainability",Active,2023-02-02,,,,,
Hertility Health,https://www.crunchbase.com/organization/hertility-health,6200000,GBP,8730095,Private,Seed,11-50,"Health Care, Medical, Women's","London, England, United Kingdom",Healthcare wasn't designed with women in mind. We're on a mission to change that.,,,"Deirdre O'Neill, Dr Helen O'Neill, Dr Natalie Getreu",https://hertilityhealth.com/,For Profit,natalie@hertilityhealth.com,https://www.linkedin.com/company/hertility/about/,"Hertility is a women’s health company built by women, for women. We’re shaping the future of reproductive healthcare by pioneering unique diagnostic testing that provides data-driven and advanced insights into reproductive health, fertility decline and the onset of menopause. We provide expert advice, education and access to care - all from the comfort of your home.",,2019-02-08,day,6200000,GBP,8730095,"Community and Lifestyle, Health Care",Active,2021-06-15,,,,,
Qatalog,https://www.crunchbase.com/organization/qatalog,18500000,USD,18500000,Private,Series A,11-50,"Collaboration, Communications Infrastructure, Enterprise Software, IaaS, Internet, Productivity Tools, SaaS, Software, Unified Communications, Virtual Workforce","London, England, United Kingdom",The work hub for modern teams and knowledge workers.,,,Tariq Rauf,https://qatalog.com/,For Profit,hello@qatalog.com,https://www.linkedin.com/company/qatalog/,"Qatalog eliminates your work chaos. No more constant pings, no more trivial meetings, and no more scouring for the latest doc. Our work hub connects the tools of modern collaboration — wikis, project management, team chat, and more — and lets you use them in concert with each other. It connects people and teams in the same way, so they can be in sync when they're not in the same place. It’s the new way of work. Qatalog is a Salesforce Ventures company and a 2021 Gartner Cool Vendor.",,2019-08-01,day,15000000,USD,15000000,"Administrative Services, Hardware, Information Technology, Internet Services, Messaging and Telecommunications, Other, Software",Active,2020-10-13,,,,,
symmetrical.ai,https://www.crunchbase.com/organization/symmetrical-ai,26406085,USD,26406085,Private,Series A,51-100,"Apps, Financial Services, FinTech, Human Resources, Mobile Apps, SaaS, Software","London, England, United Kingdom","We are a technology company that builds core infrastructure for fast, flexible and global payroll of the future.",,,"Daniel Wartolowski, Maciej Artur Noga, Piotr Smolen",https://symmetrical.ai/,For Profit,contact@symmetrical.ai,https://www.linkedin.com/company/symmetrical-ai/,"Symmetrical.ai is the first payroll solution users don't hate. We enable fast-paced companies to onboard at scale and run their payroll invisibly. Instead of countless, complicated processes and (Excel) spreadsheets involving a high risk of human error, we make payroll and onboarding automated. We helped rapidly developing companies scale up by speeding up onboarding, reducing onboarding churn, and providing mistake-free payroll, ready to payout (real-time, daily, weekly, and monthly).  Our mission is to eliminate borders for employment, time constraints on getting paid, and reduce the complexity of payroll across the board.",,2019-02-01,day,18500000,USD,18500000,"Administrative Services, Apps, Financial Services, Mobile, Software",Active,2022-04-28,,,,,
Parfin,https://www.crunchbase.com/organization/parfin,22400624,USD,22400624,Private,Seed,51-100,"Finance, Financial Services, FinTech","London, England, United Kingdom","Parfin is a fintech company that provides secure digital asset custody, trading, and management through a web3 infrastructure.",,,"Alex Buelau, Cristian Bohn, Marcos Viriato",http://www.parfin.io,For Profit,,https://www.linkedin.com/company/parfin,"Parfin is a fintech company building the services and infrastructure needed to unlock the digital assets revolution. The company's platform powers all of its products and solutions, combining the best features of traditional finance with the efficiency gains and new opportunities provided by digital assets. By pioneering Web3 infrastructure technology and combining it with its deep financial markets expertise, they are able to provide institutions with the solutions they require to access the Web3 ecosystem. Parfin's mission is to facilitate the institutional adoption of digital asset technologies and to contribute to the creation of a more efficient and equitable financial system.",,2019-01-01,year,15000000,USD,15000000,Financial Services,Active,2023-01-17,,,,,
HealthHero,https://www.crunchbase.com/organization/healthhero,128000000,EUR,151037060,Private,Series B,501-1000,"Health Care, Health Diagnostics, Information Technology, mHealth","London, England, United Kingdom","HealthHero offers remote access to experienced doctors and expert clinicians directly to patients, insurance-policy holders and employees.",,,Ranjan Singh,https://www.healthhero.com/,For Profit,info@healthhero.co.uk,https://www.linkedin.com/company/healthhero/,"HealthHero offers a suite of virtual healthcare services delivered 24/7 via phone, video calls, and online chat.",Less than $1M,2019-01-01,year,70000000,EUR,82920605,"Health Care, Information Technology, Mobile",Active,2021-07-01,,,,,
MiroBio,https://www.crunchbase.com/organization/mirobio,107000000,GBP,130209934,Private,Series B,1-10,"Biotechnology, Life Science","Oxford, Oxfordshire, United Kingdom",MiroBio is Harnessing the natural control mechanisms of the immune system.,MiroBio acquired by Gilead Sciences,https://www.crunchbase.com/acquisition/gilead-sciences-acquires-mirobio--ae990178,"Richard Cornall, Simon Davis, Tim Funnell",http://www.mirobio.com/,For Profit,info@mirobio.com,https://www.linkedin.com/company/mirobio/,MiroBio's platform is based on ground-breaking research by their scientific founders at the University of Oxford delineating how immune cells communicate and how they are activated. These insights have enabled MiroBio to create antibodies that can leverage natural signalling mechanisms to restore immune system balance and control.,Less than $1M,2019-01-01,year,80000000,GBP,97033798,"Biotechnology, Science and Engineering",Active,2022-06-29,,,,,
By Rotation,https://www.crunchbase.com/organization/by-rotation,3841955,USD,3841955,Private,Seed,1-10,"E-Commerce, E-Commerce Platforms, Fashion, Rental, Retail, Retail Technology, Sharing Economy, Shopping, Social Network, Sustainability","London, England, United Kingdom",The World's First Social Fashion Rental App.,,,Eshita Kabra,https://www.byrotation.com/,For Profit,hello@byrotation.com,https://www.linkedin.com/company/byrotation/,"By Rotation is the world's first social fashion rental app. We're transforming the way fashion is consumed by allowing users to share their wardrobes. Do good for the planet, your wardrobe and your wallet at the same time.",,2019-10-01,month,2550000,GBP,3351955,"Clothing and Apparel, Commerce and Shopping, Design, Hardware, Internet Services, Other, Software, Sustainability",Active,2022-03-31,,,,,
