RELAXER TECHNOLOGY,https://www.crunchbase.com/organization/relaxer-technology,600000,GBP,777708,Private,Seed,11-50,"Angel Investment, Consulting, E-Commerce, Electrical Distribution, Information Technology","London, England, United Kingdom",RELAXER TECHNOLOGY is an organization that lands and distribute innovate product and brands from China into the UK.,,,"Pingchuan Ma, xinran zhao",http://www.myrelax.co,For Profit,info@myrelax.co,,RELAXER TECH provides marketing and distribute solution for innovate consumer product brands from china. We are currently working with Asia's No.1 E-Cigarette brand RELX.,,2019-08-01,day,500000,GBP,656470,"Commerce and Shopping, Energy, Financial Services, Information Technology, Lending and Investments, Professional Services",Active,2019-12-10,,,,,
Bookado,https://www.crunchbase.com/organization/bookado,24398,GBP,32071,Private,Seed,1-10,"Internet, Online Portals, Travel, Travel Agency","London, England, United Kingdom",Bookado offers activities and experiences for individuals and businesses.,,,"Nathan P., Timothy James",https://www.bookado.co.uk/,For Profit,support@bookado.co.uk,https://www.linkedin.com/company/bookadouk/,"Bookado is a platform for individual and business activities and experiences. It is Bookado's goal to create a platform where you can do everything, any time, anywhere with fun, exciting, and affordable activities. Bookado's platform increases activity provider exposure & bookings while providing its members with the most useful price.",,2019-01-01,year,24398,GBP,32070,"Internet Services, Travel and Tourism",Active,2022-03-31,,,,,
Feastr,https://www.crunchbase.com/organization/feastr,430000,GBP,548738,Private,Seed,1-10,"Apps, Food and Beverage, Food Delivery, Hospitality, Restaurants","London, England, United Kingdom","Feastr is a family of cloud kitchens, delivering restaurant quality food straight to your door.",,,"Alex Metcalf, Nitin Singhal, Tom Ducker",https://www.feastr.co,For Profit,hello@feastr.co,https://www.linkedin.com/company/feastr-ltd,,Less than $1M,2019-04-17,day,280000,GBP,366183,"Apps, Food and Beverage, Software, Transportation, Travel and Tourism",Active,2020-10-22,,,,,
Snapboard,https://www.crunchbase.com/organization/snapboard-8104,150000,USD,150000,Private,Seed,1-10,"Apps, Software, Software Engineering, Web Apps","London, England, United Kingdom","Snapboard is a software house that allows users to manage and link apps and platforms in a single, customizable dashboard.",,,Calum Moore,https://snapboard.io,For Profit,calum@snapboard.io,https://www.linkedin.com/company/20512302,"Snapboard is a software house that allows users to manage and link apps and platforms in a single, customizable dashboard. It has an editable dashboard that enables users to track their data and metrics across their apps. The company offers unlimited boards with all the cards completely open-source. Users can create boards that act as internal tools without getting the product or engineering team involved. Calum Moore established Snapboard in London, England.",$1M to $10M,2019-07-18,day,150000,USD,150000,"Apps, Science and Engineering, Software",Active,2020-03-16,,,,,
Gamerclub,https://www.crunchbase.com/organization/gamerclub,10000,USD,10000,Private,Seed,51-100,"Communities, Gaming, Video Games","Cardiff, Cardiff, United Kingdom",Gamerclub is a game server provider and community.,,,Nima Tamizi,https://gamerclub.net,Non-profit,contact@gamerclub.net,https://www.linkedin.com/company/gamerclub,"Gamerclub is a non profit community and game server provider. Members can come together to discuss and enjoy their time playing video games. Gamerclub support many games such as CS 1.6, CSGO, WoW and many more.",,2019-03-06,day,10000,USD,10000,"Community and Lifestyle, Gaming",Active,2020-03-05,,,,,
AlphaStream,https://www.crunchbase.com/organization/alphastream-io,,USD,,Private,Seed,11-50,"Financial Services, FinTech, Software","London, England, United Kingdom",Hyper-personalisation for financial services.,,,Gareth Mann,https://alphastream.io/,For Profit,info@AlphaStream.io,https://www.linkedin.com/company/alphastream-io,"Founded in 2019, AlphaStream is a financial technology company leading the hyper-personalization revolution in financial services. AlphaStream's mission is to help organizations create highly relevant experiences for their customers.",,2019-01-01,month,,,,"Financial Services, Software",Active,2020-03-01,,,,,
BOBOU BEAUTY,https://www.crunchbase.com/organization/bobou-beauty,45000,GBP,58862,Private,Pre-Seed,1-10,Beauty,"London, England, United Kingdom",A NEW GENERATION OF MAKEUP TOOLS,,,"Crine Insalata, Jamie Johns",https://www.boboubeauty.com/,For Profit,criney@boboubeauty.com,https://www.linkedin.com/company/bobou-beauty,BOBOU is  British-Italian beauty brand formed in 2020 that adds a new dimension to the Makeup Brushes & Tools Category.  BOBOU BRUSHES are handcrafted by artisans using the highest quality and innovative materials for an indulgence experience,$1M to $10M,2019-11-13,day,45000,GBP,58862,Consumer Goods,Active,2020-01-04,,,,,
BuddyBoost,https://www.crunchbase.com/organization/buddyboost,550000,GBP,689552,Private,Pre-Seed,1-10,"Employee Benefits, Wellness","London, England, United Kingdom",Employee wellbeing platform,,,"Ian Malcolm, Robert Tansey",https://www.buddyboost.co.uk/,For Profit,info@buddyboost.co.uk,https://www.linkedin.com/company/68841492,"BuddyBoost is a workplace wellbeing platform that delivers mass engagement. We help employees to thrive and companies to perform better. We use a variety of month-long challenges and guided learning programs to deliver a range of wellbeing and personal development outcomes for employees and employers. As the name suggests, we encourage peer support and we help build supportive communities within your organisation. BuddyBoost is designed to be inclusive and helps employers to promote a culture of wellbeing, inclusion and knowledge. Our platform has several core programmes enabling physical activity, stress-reduction, better nutrition, work-life balance and helping to live more sustainable lives. We also work with our clients to create bespoke programmes according to the needs of their organisation.",,2019-11-01,day,250000,GBP,279287,"Administrative Services, Health Care",Active,2022-10-15,,,,,
Somnus Scientific,https://www.crunchbase.com/organization/somnus-scientific,600000,GBP,829500,Private,Seed,1-10,"Business Development, Health Care, Hospital","London, England, United Kingdom",Somnus Scientific develops a suite of products to measure blood propofol concentration in real-time and without blood sampling.,,,"Denis Lonergan, Mark O’Connell, Tim Craft",https://somnus-scientific.com/,For Profit,info@somnus-scientific.com,https://www.linkedin.com/company/somnusscientific,Somnus Scientific develops a suite of products to measure blood propofol concentration in real-time and without the need for blood sampling.,,2019-01-01,year,600000,GBP,829500,"Health Care, Professional Services",Active,2021-07-02,,,,,
Lease Fetcher,https://www.crunchbase.com/organization/lease-fetcher,300000,GBP,381570,Private,Seed,11-50,"FinTech, Leasing","Glasgow, Glasgow City, United Kingdom",A leasing comparison start-up base in the UK.,,,Will Craig,https://www.leasefetcher.co.uk/,For Profit,,https://www.linkedin.com/company-beta/18199787/,"Scottish leasing comparison start-up Lease Fetcher automatically collects tens of millions of prices from hundreds of leasing brokers and allows users to search, filter and compare prices to find the offer that’s best for them.",$1M to $10M,2019-01-01,year,300000,GBP,381570,Financial Services,Active,2019-05-18,,,,,
Lanu,https://www.crunchbase.com/organization/lanu,120000,USD,120000,Private,Pre-Seed,1-10,"Apps, Information Technology, Real Estate","London, England, United Kingdom",Lanu uses sophisticated algorithms to calculate the planning possibilities of a house which can reveal the value within.,,,"Luke Coburn, Shane O Donnell",https://lanu.co.uk/,For Profit,,https://www.linkedin.com/company/lanuproptech/about/,"Lanu uses sophisticated algorithms to calculate the planning possibilities of a house which can reveal the value within. It specializes in the fields of prop-tech, planning, technology, and valuation. It was founded in 2019 and headquartered in London.",,2019-01-01,year,120000,USD,120000,"Apps, Information Technology, Real Estate, Software",Active,2020-09-07,,,,,
Raters,https://www.crunchbase.com/organization/raters,250000,USD,250000,Private,Seed,1-10,"Ad Targeting, Advertising Platforms, Social Network","London, England, United Kingdom",Platform for promotion of digital products to highly relevant audience.,,,Rasim Aliyev,https://ratersapp.com/,For Profit,Rasim@ratersapp.com,https://www.linkedin.com/company/18189972,"Raters is a platform that helps creators of digital products to drastically increase their return on advertisement via highly accurate user targeting using our unique ML algorithms. We provide our clients with enriched user targeting and enhanced advertising insights, delivering a considerably higher advertisement ROI compared to our competitors.",,2019-03-27,day,180000,USD,180000,"Advertising, Internet Services",Active,2021-02-17,,,,,
Human AI,https://www.crunchbase.com/organization/litha-group,367500,GBP,473458,Private,Pre-Seed,1-10,"Artificial Intelligence, Psychology, Software","Leicester, Leicester, United Kingdom",Creator of the only Generative AI in the world specialising in psychological data analytics and insights,,,"Ian McLaren Wallace, Michelle Fogarty, Neil Fogarty",https://humanai.work,For Profit,hello@humanai.work,https://www.linkedin.com/company/HowHumanAI,"Human AI began research in Generative Conversational AI in 2017 and is the creator of the only Generative AI in the world specialising in psychological data analytics and insights. GPO-1 - The Generative Psycholinguistic Orienter (GPO-1) is trained on real-life contextual internal and external human conversations. PSYCHOLOGY-BASED - GPO-1 uses an innovative application of contemporary neural theory to identify and engage with the user’s current psychological state.   CONVERSATIONER - front-end technology that enables two-way conversations rather than simply transmitting messages in the style of Q&A DATA SOVEREIGNTY - users can choose to store their interactions in a secure personal data vault or opt to share them with trusted parties to generate mutual benefit and value.   EDGE DATA STREAMS - GPO-1 dynamically works with the hidden 98% (user psychology) to create short- mid- and long-term context; infer perceptions and perspectives; modify the user experience. PSYCHOLOGICAL DATA LAYER - a central repository unique to each organisation as GPO-1 captures hundreds, thousands and millions of social interactions and draws them down into a dedicated Data Layer INSIGHTS ENGINE - making analytics and insights inferred from massive data accessible to users, creating Machine-speed Strategic Analysis including the simulation and forecasting of future user behaviour. SYSTEMS OF ACTION - rather than just gathering and storing data, GPO-1 can proactively act on information, e.g., identifying user anxiety, and seamlessly and sensitively introducing psychotherapy support as a natural part of the conversation.  The first application of this ground-breaking technology is already deployed as a Virtual Companion providing support to people exploring and resolving such mental health issues as anxiety, stress, and depression.",,2019-04-10,day,77500,GBP,92053,"Artificial Intelligence, Data and Analytics, Health Care, Science and Engineering, Software",Active,2022-07-12,,,,,
Signai OpenPensions & Signai OpenIncome,https://www.crunchbase.com/organization/signai-openpensions,1200000,GBP,1570243,Private,Seed,1-10,"Blockchain, Finance, Financial Services, Retirement","Esher, Surrey, United Kingdom",Income Security For Life,,,"Alireza Emamy, Nafiseh Vahabi",https://signai.co.uk,For Profit,ali.emamy@gmail.com,https://www.linkedin.com/in/aliemamy/,"Income Security For Life - providing income security throughout the working and retirement years of adults, children and vulnerable.",,2019-07-29,day,,,,"Community and Lifestyle, Financial Services, Other",Closed,2021-08-01,,,,,
Sallies,https://www.crunchbase.com/organization/sailties,208000,GBP,276157,Private,Pre-Seed,1-10,"Mobile Apps, Sailing","Bristol, Bristol, City of, United Kingdom","Sallies provides capture, relive, and share sailing services.",,,"Chris Jacobs, Thomas Guy",https://sailties.net,For Profit,hello@sailties.net,https://linkedin.com/company/sailties,"Sallies provide voyages, sailors, capture, relive and share client sailing. They also provide long ride of sailing and dodging storms. Additionally, they also provide sea calculated automatically.",,2019-09-06,day,208000,GBP,276156,"Apps, Mobile, Software, Sports",Active,2021-12-01,,,,,
Liberrex Ltd,https://www.crunchbase.com/organization/liberrex-ltd,100032,USD,100032,Private,Seed,11-50,"SaaS, Software","London, England, United Kingdom",Liberrex is an information technology company that provides a customer flow management system through SaaS and mobile apps.,,,Achraf Ammar,https://www.liberrex.com,For Profit,contact@liberrex.com,https://www.linkedin.com/company/11128051,"Liberrex is an information technology company that provides a customer flow management system through SaaS and mobile apps. It provides its customers with high-quality product and works alongside them to help them integrate the solution with their business. The company was founded in 2019 and headquartered in London, England.",,2019-01-30,day,51000,USD,51000,Software,Active,2021-08-01,,,,,
Digital GoToMarket Limited,https://www.crunchbase.com/organization/digital-gotomarket-limited,400000,GBP,517039,Private,Pre-Seed,1-10,"Artificial Intelligence, Big Data, Business Information Systems, Data Mining, Information Services, Information Technology, Machine Learning, Text Analytics","Lewes, East Sussex, United Kingdom",A.I. and Machine Learning platform to Acquire & Enrich Data.  Experts on building and launching digital subscription products.,,,"Terry Dawson, Terry Dawson",http://www.digitalgotomarket.com,For Profit,info@digitalgotomarket.com,,"Digital GTM is a specialist technology and advisory firm with expertise in Alternative B2B Data & Information services, and Machine Learning approaches to acquiring and enriching data.  Their core platform, ADIE, combines the very best Artificial Intelligence, Big Data and Deep Learning technology platforms with world-class data science skills and deep domain expertise to create unique data sets.",,2019-01-31,day,400000,GBP,517039,"Artificial Intelligence, Data and Analytics, Information Technology, Science and Engineering, Software",Active,2020-11-01,,,,,
Hug,https://www.crunchbase.com/organization/hug-e310,150000,GBP,197913,Private,Pre-Seed,1-10,"Employee Benefits, Information Technology, Online Portals","Saint Ives, Cornwall, United Kingdom","Hug offers a holistic analysis of employee wellbeing and smart matches products, services, and benefits to employee needs.",,,,https://hugteam.com,For Profit,info@hugteam.com,https://www.linkedin.com/company/hug-international-ltd/,"Hug evaluates employee wellbeing holistically and then intelligently matches products, services, and benefits to their needs. Hug platform is much more than just a set of surveys. It's a proactive, employee-focused platform that can recommend genuinely helpful well-being resources and help employees understand their employee benefits.",$1M to $10M,2019-01-01,year,150000,GBP,197912,"Administrative Services, Health Care, Information Technology, Internet Services",Active,2022-03-24,,,,,
BlockFrauds,https://www.crunchbase.com/organization/blockfrauds,50000,GBP,63903,Private,Seed,1-10,"Artificial Intelligence, Big Data, Data Center Automation, Machine Learning","London, England, United Kingdom",BlockFrauds develops big data management software to simplify workflows and build business resilience.,,,,https://www.fardoesoftware.co.uk/,For Profit,,https://www.linkedin.com/company/fardoe-software-ltd/,"BlockFrauds develops big data management software to simplify workflows and build business resilience. Its platform utilizes AI and machine learning that offers workflow automation, a single touchpoint data ecosystem, automated data collection, and personalized data insights. The company was founded in 2019 and is headquartered in London.",,2019-01-01,year,,,,"Artificial Intelligence, Data and Analytics, Hardware, Information Technology, Science and Engineering, Software",Active,2022-05-09,,,,,
Vivify,https://www.crunchbase.com/organization/vivify-beauty,700000,GBP,879092,Private,Seed,1-10,"Beauty, E-Commerce, Marketplace","Harrogate, North Yorkshire, United Kingdom",Vivify operates as a beauty marketplace platform.,,,"Kirstie Looms, Michael Tilley",https://www.vivifytreatments.com/,For Profit,,https://www.linkedin.com/company/vivify-beauty-ltd/,Vivify operates as a beauty marketplace platform. Vivify is created for those who do both. The women slaying in the boardroom by day and the dating game by night.,,2019-01-01,year,700000,GBP,879092,"Commerce and Shopping, Consumer Goods",Active,2020-07-16,,,,,
The Luxè Week,https://www.crunchbase.com/organization/the-luxè-week,82285,GBP,100047,Private,Pre-Seed,1-10,"Tourism, Travel","London, England, United Kingdom",Technology Travel Agency,,,"Abuzar Sultan, Michael Nene, Sam Rankin",https://www.theluxeweek.com/,For Profit,enquiries@theluxeweek.com,https://www.linkedin.com/company/the-lux%C3%A8-week/,Connecting travellers worldwide for the luxury travel experience of a lifetime!,,2019-09-01,month,82285,GBP,100046,Travel and Tourism,Active,2019-09-01,,,,,
Treeapp,https://www.crunchbase.com/organization/treeapp,,USD,,Private,Pre-Seed,1-10,"CleanTech, GreenTech, Software, Sustainability","London, England, United Kingdom",Treeapp is a mobile app that enables anyone to plant a tree for free every day in less than a minute.,,,"Godefroy Harito, Jules Buker, Leo King Leong Ng",https://www.thetreeapp.org,For Profit,hello@thetreeapp.org,https://www.linkedin.com/company/thetreeapp,"Treeapp specializes in working with businesses to integrate tree planting directly into their offerings as well as offset their carbon emissions. It also operates a leading mobile app that enables anyone to plant a tree for free, every day, in less than a minute.",,2019-01-01,year,,,,"Software, Sustainability",Active,2021-05-14,,,,,
CuroCarers,https://www.crunchbase.com/organization/curocarers,30000,GBP,41215,Private,Pre-Seed,1-10,"Assisted Living, Assistive Technology, Health Care, Nursing and Residential Care, Software","London, England, United Kingdom",CuroCarers is an employee wellness platform that enables caregivers to control their own well-being and flourish at work.,,,"Hannah Lavender-Jones, Krishani Ranjan, Matt Pullen",https://www.curocarers.com,For Profit,hello@curocarers.com,https://www.linkedin.com/company/curocarers/,"CuroCarers is an employee wellness platform that provides assistance to workers who have caring duties. CuroCarers links unpaid caregivers to meet experts, exchange information, insights, and support for one another in order to better balance employment and caring for a loved one. CuroCarers provides employees with access to a crowdsourced Q&A that connects caregivers to information, resources, and recommendations. Expert assistance from carers, coaches, and counsellors, as well as 1 to 1 matching that links carers with other carers who are most similar to them to obtain both practical and emotional help. CuroCarers was founded by Matt Pullen, Krishani Ranjan, and Hannah Lavender-Jones in 2019. The company is located in London, GB.",,2019-11-01,month,30000,GBP,41214,"Health Care, Software",Active,2021-02-07,,,,,
Atypical Cosmetics,https://www.crunchbase.com/organization/atypical-cosmetics,150000,GBP,195665,Private,Pre-Seed,1-10,"Beauty, Cosmetics","Glasgow, Glasgow City, United Kingdom",Atypical Cosmetics operates a skincare brand that provides customized personal care products.,,,,https://www.atypicalcosmetics.com,,,https://www.linkedin.com/company/atypical-cosmetics-ltd,"Atypical Cosmetics operates a skincare brand that provides customized personal care products. Atypical Cosmetics was founded in 2019 and was headquartered in Glasgow, United Kingdom.",,2019-01-01,year,150000,GBP,195664,Consumer Goods,Active,2022-03-15,,,,,
FjordStrong,https://www.crunchbase.com/organization/fjordstrong,316000,GBP,439082,Private,Seed,1-10,"Environmental Consulting, Marine Technology","Portaferry, Staffordshire, United Kingdom",FjordStrong is a marine biodiversity technology company that has developed an underwater survey system.,,,Ruairí Gallagher,https://www.fjordstrong.com/,For Profit,info@fjordstrong.com,https://dk.linkedin.com/company/fjordstrong,"FjordStrong is a marine biodiversity technology company that has developed an underwater survey system. This system, called Auto-release Baited Underwater Video, is designed to survey high conservation value species and protected marine areas.",,2019-01-01,year,316000,GBP,439082,"Professional Services, Science and Engineering",Active,2021-05-06,,,,,
E4-3D ENGINEERING FOR ADDITIVE MANUFACTURING LTD,https://www.crunchbase.com/organization/e4-3d-engineering-for-additive-manufacturing-ltd,150000,USD,150000,Private,Pre-Seed,1-10,"E-Commerce, Marketplace","Blackpool, Blackpool, United Kingdom",E4-3D is a E-commerce marketplace for sale of 3D printing licenses of certified digital parts and coordinates certified 3D printing service.,,,"Irma Gilbert, Paul Gilbert",https://e4-3d.com/,For Profit,irma@e4-3d.com,https://www.linkedin.com/company/e4-3d-engineering-for-additive-manufacturing-ltd/,,,2019-01-01,year,150000,USD,150000,Commerce and Shopping,Active,2021-12-07,,,,,
Scallop,https://www.crunchbase.com/organization/scallop,,USD,,Private,Seed,11-50,"Banking, Cryptocurrency, Financial Services, PaaS","Bromley, Bromley, United Kingdom","Scallop is a defi powered neo-bank that offers a platform to manage digital money with a flexible, simple, and easy approach.",,,"Mindy Bejawn, Raj Bagadi",https://scallopx.com,For Profit,,https://www.linkedin.com/company/scallopx,"Scallop provides an one-stop solution for fiat and digital currencies. They secured infrastructure, providing a suite of banking products to empower retail and business customers. They use ZK rollups and offer selective asset privacy features on the chain.",Less than $1M,2019-01-01,year,,,,"Financial Services, Lending and Investments, Payments, Software",Active,2021-10-26,,,,,
hato*,https://www.crunchbase.com/organization/hato,79000,USD,79000,Private,Pre-Seed,11-50,,"London, England, United Kingdom",Aggregator  telecommunication and telemarketing services,,,"Denis Smirnov, Evgeny Angelutsa, Tristan Craken, Vlaicu Cernei",https://www.hato.global,For Profit,info@hato.global,https://www.linkedin.com/company/hato-global/,"We represent a platform - an aggregator in the field of telecommunications and telemarketing, which aggregates remote operators around the world, providing them with a convenient, specialized CRM (Customer Relationship Management) system and communication services. We connect the operators with the customers of the call center services, which represent the small and medium business all over the world. Using the platform makes it possible to reduce the cost of call center services by more than 2 times, and to increase the operator's remuneration more than 3 times. Therefore in comparison with the classical business model of call centers. At the moment, the project is completed by 80%, the launch of the platform is planned for May 2019. The registered legal entity, logo and trademark under the Madrid Convention of Europe and under copyright of the United States are also at the final stage. Our team consists of 10 people, we have a decade of experience in building and managing call centers, including those with remote employees, which gave the greatest result and served as the foundation for our idea. We also have extensive experience in the implementation of local IT projects, the creation and implementation of specialized CRM systems.",,2019-02-10,day,50000,USD,50000,,Active,2019-05-30,,,,,
Creatr,https://www.crunchbase.com/organization/creatr-28a5,170000,GBP,227785,Private,Pre-Seed,1-10,Music,"London, England, United Kingdom","Platform for music creatives to regain control of their rights, be empowered through data and get the credit they deserve.",,,Henry Marsden,https://www.creatrclub.com,For Profit,info@creatrclub.com,https://www.linkedin.com/company/creatrclub,,,2019-05-01,month,170000,GBP,227784,"Media and Entertainment, Music and Audio",Active,2020-12-22,,,,,
